{
  "attempted_unit_count": 93,
  "completed_at": "2026-07-29T12:42:42.130198Z",
  "invalid_unit_count": 3,
  "longitudinal_batch_plan_sha256": "ebf4b7701b4df51258e7b9e9a841b32fb6536091fd43346e0f4570073b6631bb",
  "materialization_sha256": "acfcb852f0ad4e6853d98c20f0e6c06737aa02f6430a3c0a1aea785f1183260a",
  "materialization_version": 3,
  "materialized_unit_count": 93,
  "outcomes_consulted": false,
  "probe_execution_sha256": "0c3b768af3fba6b915ae8d42d1b23679e051c0416c64ade1c14c366bfcfc1875",
  "reused_unit_count": 93,
  "skipped_probe_unit_count": 3,
  "started_at": "2026-07-29T12:42:38.994569Z",
  "status": "incomplete",
  "unit_count": 96,
  "units": [
    {
      "canonical_repository_id": "0x4d31/galah",
      "excluded_hunk_count": 0,
      "execution_unit_id": "965ceacd3d0971e7241256fb68e62def7e047d1026c9a7100bd12f799fef3edf",
      "hunk_count": 17,
      "longitudinal_shard_sha256": "db5cb82e284cfb694386276e9377ab517950155496fe46e698b42b6e267a3a1f",
      "probe_unit_id": "ab06900fc744e69ae4cab71d04885d8861619c148f883ef328de936ef73fd78c",
      "reused": true,
      "shard_path": "/mnt/agent-code-authorship/survival-study/sourcegraph-longitudinal-v3/materialized/shards/965ceacd3d0971e7241256fb68e62def7e047d1026c9a7100bd12f799fef3edf.json",
      "sourcegraph_verification_status": "verified",
      "valid": true
    },
    {
      "canonical_repository_id": "0xfurai/peekaping",
      "excluded_hunk_count": 0,
      "execution_unit_id": "192784c3690f209fe3649c8bbac94801142ed8cfa862a9a04471b6ca4d395712",
      "hunk_count": 26,
      "longitudinal_shard_sha256": "d1c26a4121b7a60ae828a34eeffb634106e62c91a9db8d652bd32534e203ba0c",
      "probe_unit_id": "2878f2054ec043c554f5a6707359ea02677c3887b79796a0f34ca8df53394ff0",
      "reused": true,
      "shard_path": "/mnt/agent-code-authorship/survival-study/sourcegraph-longitudinal-v3/materialized/shards/192784c3690f209fe3649c8bbac94801142ed8cfa862a9a04471b6ca4d395712.json",
      "sourcegraph_verification_status": "verified",
      "valid": true
    },
    {
      "canonical_repository_id": "a16z/halmos",
      "excluded_hunk_count": 0,
      "execution_unit_id": "186e1586d67d454fc2be437e7c6071958af0d3aaab3d99ea22c1c904ef6dae1a",
      "hunk_count": 11,
      "longitudinal_shard_sha256": "3682cb1cd9f3314a809acb66ad9318928bae549cbb6706ad89d22599d170132a",
      "probe_unit_id": "4d5140f58a2a3ca93332329c0bcb3c89127ae31fefe58c590b6ec3adc7e58764",
      "reused": true,
      "shard_path": "/mnt/agent-code-authorship/survival-study/sourcegraph-longitudinal-v3/materialized/shards/186e1586d67d454fc2be437e7c6071958af0d3aaab3d99ea22c1c904ef6dae1a.json",
      "sourcegraph_verification_status": "verified",
      "valid": true
    },
    {
      "canonical_repository_id": "aftership/clickhouse-sql-parser",
      "excluded_hunk_count": 0,
      "execution_unit_id": "4a5d58623d532d0e73e9d6ac10a6c136c132c3cc443336b075463ff657c77b84",
      "hunk_count": 13,
      "longitudinal_shard_sha256": "7a186da234e727e7e0fe13c6ce4f4981d0459cf6d8d5198d21edb95b7c9a354f",
      "probe_unit_id": "8f43f7f675e893d7fd1c32580c17816f28b96d08bbc382b65d4b8d44add151d7",
      "reused": true,
      "shard_path": "/mnt/agent-code-authorship/survival-study/sourcegraph-longitudinal-v3/materialized/shards/4a5d58623d532d0e73e9d6ac10a6c136c132c3cc443336b075463ff657c77b84.json",
      "sourcegraph_verification_status": "verified",
      "valid": true
    },
    {
      "canonical_repository_id": "airbytehq/airbyte",
      "excluded_hunk_count": 0,
      "execution_unit_id": "1bf71542bdb0624eee962e8e829f5fda5675a1d977f74a6fd4626224fc7f20de",
      "hunk_count": 52,
      "longitudinal_shard_sha256": "c9e71000e051fdf66740ce69bc1ec5ee533ae7405b1984b395306bf9543c7ec0",
      "probe_unit_id": "b823524b1ec156a592bedeb6af86ffc7fb0d2d9d778fd2066948c0bf6dbb24ef",
      "reused": true,
      "shard_path": "/mnt/agent-code-authorship/survival-study/sourcegraph-longitudinal-v3/materialized/shards/1bf71542bdb0624eee962e8e829f5fda5675a1d977f74a6fd4626224fc7f20de.json",
      "sourcegraph_verification_status": "verified",
      "valid": true
    },
    {
      "canonical_repository_id": "aldinokemal/go-whatsapp-web-multidevice",
      "excluded_hunk_count": 0,
      "execution_unit_id": "be3a0f20e4d726963fa847d9dc3dcff7470bb4a6a57e68784bd550fb6eb0e8e2",
      "hunk_count": 44,
      "longitudinal_shard_sha256": "2edbb1691d4b96dc3ca9084d167503bbba01145f98976b4e0b43b0b33cb18492",
      "probe_unit_id": "4ab3213c2af10d5329a4bb5187d283446b637fa8f6f128f63f478d0bbe379ec2",
      "reused": true,
      "shard_path": "/mnt/agent-code-authorship/survival-study/sourcegraph-longitudinal-v3/materialized/shards/be3a0f20e4d726963fa847d9dc3dcff7470bb4a6a57e68784bd550fb6eb0e8e2.json",
      "sourcegraph_verification_status": "verified",
      "valid": true
    },
    {
      "canonical_repository_id": "alexanderjeurissen/ranger_devicons",
      "excluded_hunk_count": 0,
      "execution_unit_id": "3fa77a628a6f7d5d1478079546dcde14a335be632504553437c50ef05924cfbc",
      "hunk_count": 21,
      "longitudinal_shard_sha256": "3466378b834aff8e66184d92cd7e7cf8bb9c4d6b6e804926e2a7dcb1b0485f9e",
      "probe_unit_id": "ea46ab33baf6fcdb56b1451aabf02295d65625ef19c350feada07ff4f76234ad",
      "reused": true,
      "shard_path": "/mnt/agent-code-authorship/survival-study/sourcegraph-longitudinal-v3/materialized/shards/3fa77a628a6f7d5d1478079546dcde14a335be632504553437c50ef05924cfbc.json",
      "sourcegraph_verification_status": "verified",
      "valid": true
    },
    {
      "canonical_repository_id": "alirezamika/autoscraper",
      "excluded_hunk_count": 0,
      "execution_unit_id": "dbf572d413abbee6f79287fe914630091e6fcb7fffd276b9eab89c6d5b4afef3",
      "hunk_count": 8,
      "longitudinal_shard_sha256": "e83872160e30a5bc2a1be95dfecb45d29943b67bdb881fdee9d4ab92c4db7031",
      "probe_unit_id": "d1ca3fbef20ccbd7d32c7d40c9cd272138989ac67013434ff054bf4470afd341",
      "reused": true,
      "shard_path": "/mnt/agent-code-authorship/survival-study/sourcegraph-longitudinal-v3/materialized/shards/dbf572d413abbee6f79287fe914630091e6fcb7fffd276b9eab89c6d5b4afef3.json",
      "sourcegraph_verification_status": "verified",
      "valid": true
    },
    {
      "canonical_repository_id": "axinc-ai/ailia-models",
      "error": "Sourcegraph blame repository does not match",
      "failure_stage": "sourcegraph_probe",
      "probe_unit_id": "ba2e3cc7629a095bf90f976b55a9f6646b02fd7069d1ec56c462894d871d9d9a",
      "reused": false,
      "valid": false
    },
    {
      "canonical_repository_id": "aztfmod/terraform-provider-azurecaf",
      "excluded_hunk_count": 0,
      "execution_unit_id": "953771689bfd65d364196ae2f3e0c05a33dec858fae8bd5eae21456a540e2d4e",
      "hunk_count": 35,
      "longitudinal_shard_sha256": "321f49f3d9ab810348e8588f4e2eae371ccd56ca6be9ee54db8226d818cff0f5",
      "probe_unit_id": "0bb6d7bfd13d34c07d8ec32db6e152d884acab15ebdad78f1bf90c5c4ee0cd65",
      "reused": true,
      "shard_path": "/mnt/agent-code-authorship/survival-study/sourcegraph-longitudinal-v3/materialized/shards/953771689bfd65d364196ae2f3e0c05a33dec858fae8bd5eae21456a540e2d4e.json",
      "sourcegraph_verification_status": "verified",
      "valid": true
    },
    {
      "canonical_repository_id": "azure/azure-sdk-for-python",
      "excluded_hunk_count": 0,
      "execution_unit_id": "677625046aaf1b875ac8071cd07621cc0c730e090ebb6294082209ac2a2d54ae",
      "hunk_count": 28,
      "longitudinal_shard_sha256": "6a640469699fa8faf57f618363fed5d887db1dac60a7c55f4637c0c9d8daf041",
      "probe_unit_id": "b72f45cdd533a2e32d65813f0d829dde0fefad3e7bfd12ada4dc722d45c35e20",
      "reused": true,
      "shard_path": "/mnt/agent-code-authorship/survival-study/sourcegraph-longitudinal-v3/materialized/shards/677625046aaf1b875ac8071cd07621cc0c730e090ebb6294082209ac2a2d54ae.json",
      "sourcegraph_verification_status": "verified",
      "valid": true
    },
    {
      "canonical_repository_id": "azure/azure-storage-fuse",
      "excluded_hunk_count": 0,
      "execution_unit_id": "9a7b979e7c89da2a17d9d03a828dae0644a44183de06717e4335d0668e57ddb1",
      "hunk_count": 7,
      "longitudinal_shard_sha256": "5e5fd161a7691de945a3a458f11c1991c0d69a7319cb36d00b044c976c628873",
      "probe_unit_id": "bc6de03d9b2185fc12e6bf405219550521d434cc734f86d74ead8ff590f7be3d",
      "reused": true,
      "shard_path": "/mnt/agent-code-authorship/survival-study/sourcegraph-longitudinal-v3/materialized/shards/9a7b979e7c89da2a17d9d03a828dae0644a44183de06717e4335d0668e57ddb1.json",
      "sourcegraph_verification_status": "verified",
      "valid": true
    },
    {
      "canonical_repository_id": "badtuxx/girus-cli",
      "excluded_hunk_count": 0,
      "execution_unit_id": "7d5d62e3eb15763c802f11a5880e15639e5b3d8f56c5204e9fe888942016d977",
      "hunk_count": 24,
      "longitudinal_shard_sha256": "899ace1226d78a97b5684eda11f0549465604ce225b5a68d078b1d1ac8622c40",
      "probe_unit_id": "260ab010e3785d3523e72201a47d4f936787b3c9f091f8cc589c9d0a92737dd6",
      "reused": true,
      "shard_path": "/mnt/agent-code-authorship/survival-study/sourcegraph-longitudinal-v3/materialized/shards/7d5d62e3eb15763c802f11a5880e15639e5b3d8f56c5204e9fe888942016d977.json",
      "sourcegraph_verification_status": "verified",
      "valid": true
    },
    {
      "canonical_repository_id": "bayesianbandits/bayesianbandits",
      "excluded_hunk_count": 0,
      "execution_unit_id": "a2a78d0b04dd924e5e52048a44ff50660ca72b3a2974b613ff753dbe7e1b0e07",
      "hunk_count": 6,
      "longitudinal_shard_sha256": "2c48fb59a1af07f9fbb403e48a8ebf536278b88186c6e03b7cf56be587500c47",
      "probe_unit_id": "30a5d5ce36732780a1c75977aac0dac57a59ce6b071f95bc9fedd96c690fd2f3",
      "reused": true,
      "shard_path": "/mnt/agent-code-authorship/survival-study/sourcegraph-longitudinal-v3/materialized/shards/a2a78d0b04dd924e5e52048a44ff50660ca72b3a2974b613ff753dbe7e1b0e07.json",